CommitID,Commit Message
000a02433ae27348082ee0008fe65e3568f21508,added additional device and component abstractions added device and component event listeners
000d011444d9bd24028e59b23e2e20842c9da876,"* In alignment-to-text, tsv or tsv-single-base output there was a column for score but no header. added header. * For the QueueObjectPool, made a more generic interface and added a Null version that always creates new objects. This can be used for performance comparisons. * Added another layer of object abstraction GobySamRecord which contains one or more GobySamSegment. Things that exist for the entire read are stored in this object and the parser returns a GobySamRecord instead of a List<GobySamSegment>. This is easier to understand and models the data better. * Discovered a minor error with GobySamSegment sequence variation generation * Added tests from seq-var to verify seqvar during clipping, indels, etc. Make sure gsnap->sam->GobySamParser gets the same output as gsnap->compact-alignment->display-sequence-variations which enabled me to find one more issue with gsnap->compact-alignment seqvar generation related to soft clipping."
002bb4a596fe2a53e079311c72a0a7dcd0286511,added LooseCouplingRule
007bdbe3db9568eae14b4ae438c5914b020ee98d,"Extracted the administrative methods from the services and into a separate ""ServiceAdministrator"" component.  The use of composition rather than inheritance allows each service to reuse the service management functionality without having to extend a base class.  "
0086c134c688328867c600f4f0768f65779527a2,Added group size message to ECF shared object-over-xmpp messages
008807938f612951c7757ab5f6af6edc9f8bca92,added getSolver() into LUDecomposition
0093e11bcf754e98d4cea5671e5228020e27888e,JBQA-8017 Size rotating handler test rotate-on-boot attribute
00949e3dcfa87a33262f5650fe923a5665a0cb59,fixed WICKET-2076 Need a way to programmaticaly configure the size of the chunk buffer Issue: WICKET-2076
00c06e9e52f416599bb9b906c32857848a9abd39,Performance improvements:  - Memoized MathUtil's cumulative binomial probability function.  - Reduced the default size of the read name map in reduced reads and handle its resets more efficiently.
00cb8a4abd7a11e94b6f6b0b9552b2001f25ecfa,"Make bitcoinSerialize() return a copy by default, provide an unsafeBitcoinSerialize() method for high performance applications that are willing to deal with the extra API complexity."
00e89ef9bde9cda2af1fedd704ed56aedb9840be,tightened implementation of the abstraction of the graph configuration.
011a429ced6b6fe232897c8446071b78fa0aaa3c,improvement: preferred tile size set
01377b12d71a4e9081da92ed437cd7131b712802,Fix bad URL rewriting during CSS inspection when nut comes from heap composition.
0144f93d4f30e86bd18448db7eb2343ef2a7f2f4,* SchemaIndexProviders are now loaded as KernelExtensions * Simplified solution for using in-memory lucene indxes when using an EphemeralFileSystemAbstraction
014dda94e2e055dff42e99f9e03897da08d51080,Make chunk size an argument. Default is -chunk_bits 24 -> 16MB.
0161ed4c1ce5be9fb4db3f15fe5df1f304a9e4b0,Extended renderers to allow a more compositional and traditional approach to interface engineering
01680cd1c286708dcc1d2ecbc06646d1aba106e4,Adding streamy vs chunky abstraction
017a5f76027c8e3e411734d6e9ad926be31fc2fd,inheritance of namespace declarations for nested bundles
01e0c3868d58af462d9f5a53f01aedea717de6e2,Fix for query parameters deserialization with remote connection Fix for ObjectDatabase automatic OClass generation and inheritance Fix for ObjectDatabase in version field conversion
01e0c5c7770f563ee6ce9a039acd2535e2e19b90,sketched out the start of a columnstore abstraction; investigating better ways of modelling financial apps
01fd4b05a9a5f19780e0c48d9138bc0ff141b10f,Fix for the issue 4. * making sure that connections are all established before migration. * redo size call if any of the block is migrating.
0224771828de8da5543d64061476e7b7201387e5,Introduced Datastream abstraction for use with DatastreamService
024724e1bc580a892c88fb822bd95b812aa88be4,Working on drivers for Plink's MAP and PED formats. Added a helper function to count the number of trailing newline characters at the end of a file to correctly get the number of elements. Restructured into packages. Introduced class 'Biallele' for the data types. Applied inheritance to data types to avoid duplicate variables.
0273872b34cde42382815e5c125cb2c99d60ef38,"bug 7362: we were missing the size validation check, when we create a volume from disk offering (the storage.max.volume.size param wasn't being used for validation). Fixed the same, made the validation method name more generic to be applicable to all validations, and changed the param description to denote GB as the unit status 7362: resolved fixed"
029f5e5ed52a9fafe38c8c1eab8c66380f713c3d,Added proper font size management to the new GUI
02a9597aa2ecaba3eaf81c90b1948299d3b2cb13,DDF-512  updated so that HazelcastNotificationStore uses Hazelcast directly vs. platform cache abstraction
0303792b0d568db58dd8934466a6802b1037846c,REPLACED tabs with blanks (4 per tab) UPDATED readme UPDATED bucket merge to reset the file size to 0 after a merge
0308bb821691c00d8cbbf4dce01e489745463a41,MAHOUT-251: Generalized and refactored Dirichlet models and model distributions to  remove 2-d and dense vector assumptions by introducing a new abstract  VectorModelDistribution to provide a modelProtootype and size to the distributions for  creating prior models of arbitrary vector size and flavor.
0365bcfd7d1ffe627d372bf1aa72d6b944bbe1ed,added metadata abstraction
036cbcc827b22b719a6c4b863e4c641ed18b7183,"BLC-799 : When setting up a datasource with a ceiling entity that is not an interface, the inheritance hierarchy can be incorrect. (cherry-picked from 785dd2c)"
037b45eb3265391c75ba166a8fa337e7fa77a771,"expaning writer abstractions, refactor packages, removed unused"
03afbea918471a1b536c0754b10719adc0317135,"Optimize ImmutableList,Set,SortedSet builders.  In particular, uniquify ImmutableSet/SortedSet contents in-place, and make it so that if an ImmutableSet/SortedSet is initialized to the correct size and has all unique elements, then no copying is done at all."
03be522a8dd579d670d87d81ee5e7a8075164b57,"CAS-1116 Refactor KryoTranscoder to use an initial buffer size and add explicit buffer overflow protection to handle what should be edge cases with proper buffer sizing.  Also, correct improper usage of ByteBuffer#array(), which caused entire backing buffer to be stored in cache instead of just used bytes. Unfortunately the fix requires byte array copying with the resulting object allocation overhead."
03c84e218ab1fb9cc0b63a594df59587b9bbd775,Remove some index fields in order to reduce the size of the document.
03eb204d37eca4036fe5008cc425e2da7e28dec0,Fixed a window size bug in the download sites editor. Added the ability to download beta modules from Crosswire.
03ed1447a79bd71f9f902e5bb32ef25886aa0397,cleanup of Encapsulation class
041df9cd9bacf74a37beb8977e86d9961223b1de,Merged EigenDecomposition and EigenDecompositionImpl (see MATH-662).
04503ffcfd52602f1c73cd14b70475a4810d7bdd,Refactored to use annotations instead of inheritance.
045dc64d4ff11936876ab19df64c3dd3658b6ef2,"Added Peer inheritance in comm. tests, user-defined CommAddress"
046d5362ae850b8720133d601aff7c7ad3d06212,Reduce size/complexity of app.js serialization (#959)
04732332cb6fbcb06465b46cb8e1d006e635d8c2,Browser should open to maximum size by default
047b5c891f9aa8f2157573ca22a339297ea1f8ac,moving the recomposition out of the main method
049c61c4ac19e0f2f5af5ab4568e77763bf81f84,[KARAF-831] Added cluster:group-pick command. Also added output suppression support for all group commands. This is really useful for command composition.
04d6eed048c5c6ee1f82d260710e981253be47a9,JaxbCollection: Renamed size to maxLength
04f0b11c85fa33d4900812f40be920e8a5bdfdae,webadmin: Edit/Remove Template & VM abstraction (#748413)
04fa5d4b99989d96a478fd788b0e821aba9f32d6,SPR-6093 - MVC Annotation Inheritance
0504ee4fc9653fb9987a7bd3a1191bd93317420b,Remove uneeded abstraction
050af3c3f7f25904d71c2dd83c9b8c29ecd574e8,Issue 176: size can now test compatibility with images; refactored vcloud config logic; updated to support latest bluelock
0515bb5b19bec22a7f864bbd1b2b57be2f7e290e,"Added a layer of abstraction, to make it easier to insert a new ScriptEngine"
05630d5f3942a18c7ca40866bfa963de81863b6c,SONARPHP-613 Improve ClassComplexityCheck
056ba53d2604d02452514571efecbbe257ac114a,IDE-943: added abstraction to make IContentAssistCalculators independent from WTP's internal classes
059c43b306553754b8bca0b40c87b1c8bf52c047,major overhaul of the JavaDoc mechanism to support JavaDoc inheritance
05d88e1c19040b6455625cb08113500d2be0ceaf,undid generic DocumentAccessor due to unnecessary complexity
05d9a851f61848991e893dfb7d76f22a68fca4b3,"Tighter coupling of subscription expiry logic with other subscription management. The previous implementation could detect an expired subscription, allow another client to subscribe to it, and then stop the (now active) subscription."
05e69b62940f47845355cca8fd28bd234f2ac4ee,Refactoring of SlidingWindow class in RR to reduce complexity and fix important bug.
0604cf11988159406201bc22cb617865d31a97fc,Fixes #216 Interceptors do not support Entity inheritance
0627a67dcec1ad8422b2d12ab0c781a1736bc397,"Minimize transient garbage volume by optimized serialization based on the 'Kryo' library * AutoKryo     extension of Kryo to allow classes to control their own registration, trigger registration of associated classes, and deserialize classes without no-arg constructors * KryoBinding     binding for use with BDB that uses AutoKryo serialization for a 2X-4X reduction in byte[] size * UURI     improved serialization via Externalizable and Kryo's CustomSerialization methods * BdbModule     discard deprecated CachedBDBMap option     (getObjectCache) extend with both declaredClass and valueClass (for when map values are specializations of the declared type, as with frontier.allQueues)     adjust type declarations * ObjectIdentityBdbCache     use KryoBinding rather than SerialBinding * CachedBdbMapTest     discarded * BdbFrontier, BdbServerCache, StatisticsTracker     adjust type declarations, objectCache creation * BdbMultipleWorkQueues     use KryoBinding rather than (Recycling)SerialBinding * BdbWorkQueue, CrawlServer, CrawlHost, CrawlURI     add autoregister support * LinkContext     public for kryo registration  "
064132b1676a5c795daf138d46d96952a195006d,"Uses DEV_NULL instead of SYSTEM StringLogger in many places, as well as abstractions instead of printStackTrace() and such. This greatly reduces amount of logging to the console when running kernel tests."
0675b6a8bad7650e6c962012dd34a7954ef39b5d,fix configuration abstraction for c + tests + minor fixes
0694bd0c7fed582466370a64f890b1efd46a2dc7,XWIKI-11460: Allow filesystem skins to indicate a base skin * better handling of cross inheritance
06975ddd9adf669e8e2fa1e406fb748648b5d028,"New tests and fixes - inheritance, injection"
06c5ab871501d7fb09b56eb47e9ebff48de842e0,Complete LUP decomposition with pivoting
06e892365ec5ecef05df28690a4ccaccf5c4e452,"more code cleanup, exporter is now even simpler due to composition"
06f104b748d52f5d229a6cb5109e29c8df158024,Reduce complexity of tool framework
0728e4343f69319d5a0461b36a04c126655b1a7c,Created ValidationEventHandler which allows the xml file to be validated Validates xml files before they are unmarshal Added an additional method to auto find a elementMass file in default location Generated the schema for aminoacidcomposition.xsd Change the XML file structure such that the element weight is directly recorded instead of computed Remove all the test cases for the computation of the abundance. Successfully generated an XML schema for ElementMass.xsd and AminoAcidComposition.xsd Remove abundance from ElementMass.xml
072f877d4581c20b0b7259468acd37f770d3b0e2,Support for scale relations and checking them in coupling
07614aa826b7b50a5c88106a20d8e9db89ee6002,Break apart the inheritance structure of the timeline into Timeline and MessageListener.
0791beab8ff65600c57cc8b3fd4dc38f61fb8f4e,"Checking in downsampling iterator alongside LocusIteratorByState, and removing the reference implementation.  Also implemented a heap size monitor that can be used to programmatically report the current heap size."
07b657b0190261e47e6c8b58d7a83553c09c5c49,allow inheritance of @UseModules
07bc39015db51be24c655a2719fb11a8a1953f0e,more inheritance testing
07cc23bf808d1a5e840b6a7d57d4d0d8a78a03f2,Added popups. Introduced page-level abstraction called container for pages and popups.
07cfb765c94f811d641f833b84fe625c5b562017,[historyView] Reduce commit dot size and expand lane color palette.
07d4e8c63de63e589b7bf807fecdf64d167565d3,- A bunch of JMX related tiding up.   - Added a sendTextMessage() method to the DestinationView so that a JMX console can send a test message to a destination.   - Renamed a few bean properties so that they would be more consistent:       - use get*Counter for properties that keep incrementing       - use get*QueueSize for poperties that repesenet the size of list in broker.   - the gc() method on the broker is now the only one expose   - the CachedMessageCount is not exposed anymore.
080c249740a67a710857f82f6ace5c24f317a96e,Bug 497008 - java.lang.StackOverflowError or eclipse crashs when using Quick Type Hierarchy and Open Type Hierarchy on cyclic inheritances
081d4f5bc71d21a1c62083151ec35e1a6b08ee00,"Dump sample for Mysql, file size request, file size printing for dumps."
088bf71f83df6694141be244bb1db698a82e878b,bug #5154 : incorrect sender for pdc notification - taking the opportunity to fix a little problem around the footer of the mail sent by delayed notification mechanism - refactoring the inheritance of created PDC user notification classes and renaming them in order to be homogeneous with the existing ones
08bb597f379d4f868d01efd47adf708eae942c47,"continued cleanup, made tables joined inheritance and matched nullable/sizes"
08c115617b1a7ab1b68a440b21888918c3a89117,"HIVE-1631. JDBC driver returns wrong precision, scale, or column size for some data types (Patrick Hunt via cws)"
08db4cfee2cf85377e6535e447d7350e97683d61,[C#] Updated complexity distribution computation
08df27b22679d95c532b2e1ef082035f2e925e56,"major reimplementation of list and combobox binding dynamic filter and dynamic sorting is now fully supported through java.util.Observable. selectableItemsHolder replaced with selectableItems property to support any selectable collection type like ListModel, Collection, List, ValueModel (containing a collection type), Object[] or Object (single selectable element) reduced complexity of ListBinder/ListBinding. Collection type for selected items is now determined from propertyType including single selection and multiple selection ListBinder and ComboBoxBinder now supports the definition of preset values for selectableItems, filter, comparator, editor (only ComboBox) and renderer to support further customizing "
08f4d0c02165b2aa9b6438a2bb33d61cffdae496,MIFOS-5111 : size of the image is fixed
08f9a69eee8b25aee902f93848e23ba0639c2306,Removed the obnoxious size pair and replaced it with two ints. NEW - # 348: Provide a TileStore implementation for accessing remote WMS instances  http://tracker.deegree.org/deegree-services/ticket/348
0912c198a9727c541dc688bc9438fc7ea6de2452,StewartSingularValueDecomposition: re-factor monolithic code and ugly switch statement into multiple methods
09202c0d82be02bf5979c2cd627acdd8d5b709da,Enhanced tool palette composition functionality. Added Morph Activity/Gateway features.
0921796ab6415681e09e5870450227ee7414a326,Refactor Main test class to have higher abstraction
094adc5b7b2a7d1e2406b5ceb6d81b85246e1120,SONARJS-509 FunctionComplexity: ignore AMD pattern and IIFE
0976cda3d786eca49d7630d4f3c66219f5b9bff9,"Common abstraction of DockElement, DockTitle and other elements representing Dockables"
0982bfab6b8fd9b52c5d3806f07e75213721ab12,"Adding a notion of a graph composition, which is a series of GAV-sets each optionally paired with a filter that can be combined through some calculation (optionally) like add, subtract, intersection...then allow the RepositoryOps recipe to use that for complex recipes. Also, add the preset factories from aprox-depgraph (integration with cartographer) here so we can use them in embedded mode if we want."
098c1f0fd46a7844c1a6a36f10588b094e5f9ddc,"remove @JsonIgnore, remove inheritance of KillBillObject (auditLogs) and refactor worng property names for json building"
098ea617270404419252aad78c4611b1920c2ab4,reworked groups (again!); now inheritance works
098fbe687d2aa290e12b46ffeaf3f6921469afef,Major refactoring of FormModel related code: * Reorganized interfaces and implementations * Reorganized package structure * Improved JavaDoc * Introduced validation abstraction * Removed dependency on Rules for validation * Dirty tracking now works for unbuffered form models * Dirty tracking now fires property change events * Revert now works for unbuffered form models * Improved unit test coverage to about 80%
09aa7d72e179bc34850559fa960d8252f08e8b52,"[BACKLOG-4709] - Small changes in platform to improve performance - UserSettingService    - replace keySet() + get() combination with entrySet()    - remove useless object instantiation    - remove useless explicit map.remove() - AbstractSpringPentahoObjectFactory    - add logger.isDebugEnabled()    - remove useless non-null validation - OrderedApplicationEventMulticaster    - replace ArrayList with array for faster sorting    - extract stateless Comparator to a final field to avoid useless instantiation    - replace new Integer.compareTo() with Integer.compare()    - add tests - RoleAuthorizationPolicy    - create ArrayLists of exact size - JcrRepositoryFileAclUtils    - iterate through List, not Set - DefaultPermissionConversionHelper    - replace indexOf("":"") with indexOf(':') as it is more effective - AuditConnection    - change the order: first try to obtain a connection and only then sleep"
09ba39420d1e1afa1f77ed4f0a7f3a1f4501622c,Implementing code review comment from r428: Using Polymorphism for exclusion strategies for expose annotations.
09ce9aa6739652ba0d99c4a0a397c0991966754d,Added test case to ensure inheritance and properties work fine
09ebc3d811fb41e4327bd7d3c822c0508ffd3e87,Set default tray icon size which caused Tomighty to crash on start under MacOSX 10.6.8 (Lion 10.7) (issue #41)
0a261245e87793b2448921854a781f0f82f66f34,Iterator now cover splits exclusively within their range (was off by 1).  Also fixed problem where the buffer size exceeding the split size caused overlap in the iterator.
0a35c8e0ba41f8206750986368441fd1ee321e8e,"1. The joint estimation model now constrains genotypes to be AA,AB,or BB only (i.e. to use a single alternate allele).  Note that this doesn't work for the old models (point estimate or SSG) because calculations aren't divided by alternate allele. 2. Allele frequency spectrum is not emitted for single samples (since it doesn't make sense). 3. If in pooled mode, throw an exception of pool size isn't set appropriately."
0a730beb2a518a1ffc9bb363f25de239331e2336,[bs-15] Integrate audit abstraction into Spring Security setup
0a7a013167b6ae5bdceb534c9e8c2ae509302fd7,Removed complexity.
0aa150baab20b1166738273e2b91442c6c382f46,more refactoring towards a cassandra abstraction
0aac921f312127aa2afa6f4fdacd38de88311d1a,Adds base api support via single-inheritance interfaces
0aad0e87529a0562ed50911aff5ceea9bfacab5e,Refactoring of filters to make better use of inheritance hierarchy.
0ae0771ce402b7992acd6433728205f9aadb1dd6,Reduces the size of JavaScript emitted by HtmlWriter#writeAllGridJavaScript and changes it to not fire if the layout areas are already in the right order.
0af567742385370007a0589b5c8fc4ae6f40e3d1,"Clean up Navin's abstraction over Hibernate Core, clean style issues, apply back changes from my original fix patch"
0b160ef24716427b495e6b472878cb855d8858d8,Fixed bug on change file size reported by Anton.
0b279a4e3a64d6cf60c4c89f55d2ca0f5a4eaf55,Removed FieldDecompositionSolver<T>.solve(T[]). This is in accordance with JIRA MATH-661.
0b3387692ed36af122004f3fb0627df1bbd6b8f4,Throwing out the Key and Value classes for now to reduce the overall complexity
0b6a42405d96ec44c718fc088999a309628f32fc,Refactor People Project & Inheritance Projects
0b7272cb810e0cebe9c9fd4d274ec39b288cbb78,ROO-2018: Roo 1.1.1 does not support inheritanceType TABLE_PER_CLASS with GWT 2.1.1
0b7eba9b9fed077e425ca97864166fd38af92670,Improved the UI for setting the battlefield size when creating a new battle.
0bd7ade93ac8db3f3fff665e9d664b6ec590cde7,adding valiation to Jaxb. Replacing strings with statics. correcting the composition of the specicmeasures xml
0c1121896cb6c3962b0b045303f1389dbef198e5,"Totally rewritten to simplyfy and compact the code + added 1200x1200 size, and set the step size to 100"
0c11c42d1116d162483c7fb3e5f259d883ca5479,"A custom Info.plist file can now be specified on the command line. Also added other iOS target specific options (-entitlements, -resourcerules, -signidentity, -sdk). (#92) Auto-generated Info.plist used when no custom Info.plist have been specified will now support iPad screen size as well."
0c1d50e25139f237ad6bd73fc198988cbd5299bb,"Added abstraction to messages, to contain senders ip. Necessary to determine which slave message comming from at master, but also used to provide masterIp at slave's initial setup"
0c35e381af5877fbd1611369a95901dadf6a3973,Reduce duplicate code and code complexity
0c5e9fa235cdc37ef71bea53c38c014740f52840,created sketch of type handling removed unnecessary abstraction reuse for declaring type
0c6da4b7b8cf2eedf0a272dc9938176a8c90c60e,Refining HttpServiceProxy abstraction.
0c70846a103152bc0e8365ba02ee46b44fcc206f,Minor decomposition for extensions
0c7f1f64d3da4dc1049def9fe43d481bbe195e7c,Reduce move generator complexity
0c86e50379487869b62bc070f21a69d905731b36,SONAR-5531 Set max limit when page size is < 1
0c998b8f9224532b6a67bf5a702d7bb5f1750dd5,Changed JOhm persistence paradigm to JPA-like from inheritance-like to make API use annotation-driven and minimally-invasive.
0ca92aa33ea70b9557fbf21af2d43bea085a4529,#135:  Comments InheritanceCompatibilityChecker
0cfc4132e690b08efdf8ff7e38326b68312b806c,SONAR-8743 Handle only leak period when computing new size measures
0d55e1a14430ee18a84de6f985da86dc61d7ae80,HADOOP-6949. Reduce RPC packet size of primitive arrays using ArrayPrimitiveWritable instead of ObjectWritable. Contributed by Matt Foley.
0d5e102eee1737502bd246634d0713a7ce9e2c23,More abstractions in Adapter pattern + exercise for Bridge pattern
0d6ef0607617f9968c9fe1267b6fef48e5d329ab,Reduce testFileGetParallel input size to ~160 KB
0d941bef7eb5bbaef6c180ad957dfb2d802dd005,"Fix for 256-bytes payloads, better errors for payloads that exceed the maximum size allowed, ability to estimate the size of a payload before adding a property, option to reject properties if the size estimate exceeds the maximum size allowed, new class for running specific tests related to reported issues, and more."
0dc98ff98c52aa5c77a2c395d4ee86527bcca95b,EST-76: more decoupling (asset from lease)
0dce81697bba4f83a8b47e6d30dd4031c4a5e314,first steps to refactor the database layout code to use class inheritance
0e773664d29d6f5e24ca5ebcc88a373ad580ec41,Semantin analysis decoupling Integration with prototype e4 DI integration New extension point
0ed552d8908c3eb57cf642fa583129a5cb10c462,[PLAT-2500] Initial work on dynamic composition of market data providers
0eedef5ec5bdd052bb407506f93290e82f4243c3,SONARDOTNT-49 Replace complexity distribution by class -> by file
0ef41011274821b6720767dcfa8c478e3fc3a51e,Renamed TrafficCompositionInputData to VehicleTypeInput to more closely correspond with the XML element name.
0f3049652a72e2abebc14a79140fe66d200045f0,"Start to build BWT abstractions, so we can present a reasonable facsimile of the BWT to the user no matter how it's represented on disk."
0f31e354d31285e55868e56bd3be22684a54c5e1,use eclipse prefs for indent size and initial indent
0f4fcb13f47462461800a53612675d964b02a220,fixed inheritance recursion
0f528d00254fd77010d062d87476e602ce8aa967,"Reviewed by tlerios, Colin & Will per ENG-508 1. Added 2 new constructors to ExpectedFailure. one default and another one that accepts I18NBoundMessage. Updated all usages of the single arg constructor with a null value, to prevent compilation errors. 2. Added a mechanism to abstract out instrument specific functionality into pluggable classes. All the instrument functions in this checkin are abstracted out except for XML serialization, which requires the specific Instrument classes to be included in an annotation. 3. Added new option position APIs & option symbol <=> option root lookup APIs to the client. 4. Added pluggable mechanism to extract & insert instrument from / into FIX messages 5. Updated PositionKeyComparator to use new pluggable mechanism for position comparison 6. Updated orderloader to support options 7. Removed OptionSymbolSplitterMessageModifier & its unit test as it doesn't make sense for options any more. 8. Updated ORS to save the fields for options for position computation. Added implementations for the new client services. 9. Updated FIXConverter and RequestHandler to add a particular FIX field to the message only if it is supported for the specific message. 10. Added OptionRootUnderlyingMap abstraction to the ORS for carrying out option symbol to option root symbol mapping. 11. Fixed an issue in the suggestions view that was preventing the photon strategy perspective from opening up."
