CommitID,Commit Message
b3f0a92bd67994710e1a49ed54e29bd7a2b8f4e4,Refs #3694: Updating Network View WIDTH/HEIGHT when the RootLayout manager updates the content pane size rather than listening to component resized events.
b407b408da8c9d2f395735205b0e286eed78a6b8,Issue 56: Support for the maximum allowed size of a single uploaded file officially
b41e970015df99ec0935963be27c955e8d79626b,saving tings.  need to get rid of this InheritanceType.JOINED garbage.
b43b375b0dc4b6b514e4d961296e0e7eebc3c8c2,JBRULES-1875 Load Composition XML files for multiple resources JBRULES-1874 Create Resource Framework
b43cc3dc10930a5a37959326b99f99c2ba0f18c5,cleaning up naming and sorting abstractions
b471cd284c89a519eeac0e0f69fffe94301b5ef5,KS-436:Lack of size unit of many attachments when viewing Entry
b491126eb328b40986aa68a7f02c739b7d55f00a,Huge decomposition of all web services bot tests
b4c0a59725d08cba0680596420eff708b9f2bc10,Update of call hierarchy complexity check
b4c4886f53903e0dd65c64a619efec89575fe853,rename size to samplesCount
b4db43bce7a46a8eff77b095f8d8ef5897aa9057,more inheritance testing
b5289eb94f263d469a0098a590a0907e8cd6c018,"Position the platform capability details dialog relative to it's parent, and provide better formatting of size values"
b52ee59b7637cd03e5840fdeb0392320c726aeed,fixed icon color on tab editor dialog moved reply count to left of retweets count fixed drag handle in account manager try to fix wrong profile image/preview media changed some text adjusting profile image size fixed account popup style on compose dialog trying to fix api version suffix
b530bad0b581d817f92b8a60d164fde1e9745074,#34 : Refactoring RiverService with abstraction level - package refactoring
b53933f225e21b890a9cc25545be7ce4223ba0ce,basic framework for physical plan.  abstraction of graph classes.
b59287975d89c77469a1e832374825b128f7da4b,"Fix Bug 210278 partial Added initial support for chart in xtab. Now chart in xtab can preview, with some size issues to be fixed later."
b5948401d8310aebeec3f46b1cd705238b9a8824,Changed metadata format to include size of compressed blocks
b5b3c63afcc632c36852e6e277ece902cad1f58e,Refactor everything to get rid of the DomainGroupVersion abstraction
b5b496d2c001fba49239de03d315d387f6bba14c,Fix quality flaw: reduce complexity
b5b939c3652fce8962ceb14b87626bd0b9a889c2,Test read-only collection with size annotation attached to a field
b5d21108da24f8344be3bc708c7afdfca9a1d089,@Configuration parsing fully relies on Spring's MetadataReader abstraction now
b5d5304313a9a78e284f3bfcde539c50347a62f8,ConnectionSource abstraction layer to allow custom transactions management
b65cad05b955257891412f8da930ab9a4ce29258,"MATH-887 First steps to enhance encapsulation (goal is to remove the ""protected"" fields): used new API (MATH-874). Replaced explicit loops with matrix operations. Disabled a unit test that does not pass anymore."
b66fe0e081e591dab7336c246f73bdce2ab1ddc8,[xcode] Extracting source and sink abstractions
b678e454c583b023b843e86d28f3fcdb8ace1de6,Fix memory issues with Es6ToEs3ClassSideInheritance.java.
b681d57b387b18a90b2d46c5e926433e79ae4d26,add many more Dshini operations - finer grained operation decomposition
b681e905c3bbd44760183512f7553497c1a720ab,Changes to Tokenizer creation and abstraction. Separated sampling jobs. other minor changes
b6a552b479884493e736fe98e679d56bd1870a26,Issue #713. Migrating field mode_of_inheritance to global_mode_of_inheritance (PatientClass). Renamed migrator class. Changed NumberProperty to StringProperty.
b6b62e3b8c2e32b44083f0e2da94acd968678ac0,nice batch chunk size handling
b6d0586befb3417a72730443770abb223b9cae83,Reduce the size of PackWriter's ObjectToPack instances
b6dd1a8dfc74590977fcfb89dd7f86e75e5cd310,Added missing input stream check and the block reader no longer returns the magic number and block size bytes
b6e633e45d754b326d067f00f60cd3ccc9d93c5d,"More abstraction on the notifd singletons... head will be broke until this is complete-David"
b6e8326b7db39ddaa48624814621602642dbb515,TEIID-2210 refinements to the object translator. decoupling the translator logic from the connection logic.  this temporarily breaks the functionality
b72309d80be5a2214df6e0a66d1a0e30f7ad45be,store dialogs at the location and with the size the user has given them
b75201f97dda3a2cd20e805ea30402677bc04a9a,worked on support for inheritance
b7a3891acd5edbdb72901c8a948aff321b5e77aa,ParamSetter abstraction  @Body contentType
b7c6718cdc97806d8157a3767b46f736d8d79c08,"WYRL: ok, the rewrite complexity is now starting to do something vaguely useful."
b7ff8fa16627a52f019aca4e7796061c3766f42a,Rename factory methods for composition data type definition to 'create'
b805610f337fff8f5658c0046e4e987d04c5167d,Committed Markus's patch to fix bug 329915: Save size of quick assist proposals popup
b808e6af7b2c5002e77c24e41b27ee5d911d7d8a,* lucene index provider is aware of ephemeral mode and uses RAMDirectory in such a case * index.db and lucene-store.db now uses FileSystemAbstraction and are hence in-memory when ephemeral
b80d52a437c3db8f616e37d4792110bcc35542a7,work in progress on entity context inheritance
b8145e2728032d0e04e43e4687fc3e0c565e3824,Allow the scale to be configured based on the size of the canvas.
b83fe9b501612c36b890cb378d128ef9371d3c26,SPARQLClient chooses GET or POST depending on query size (currently the limit hardcoded at 8KB)
b8516fee92e4ab3c4cf6c95708f512abbccd85da,"XQuery: (Index-)Range Queries, Path/FLWOR rewritings, Skeleton Access for size estimations, ..."
b8bdde5e341b95afad6726f00c76f303f5de25b0,SONAR-3257 use max size when pageSize<=0
b8d05a00eef713c13b736fb637b6f2a44811420b,"Configurable chunk size via ha.com_chunk_size for communication chunks between server and client. Also reduced default chunk size to 2M from 16M. A chunk size of at most 16M is still possible to configure. Made read timeout for the ""copy store"" request twice that of the normal read timout to be more resilient to slow network or bogged down master."
b8d266fbd8422c51cc6fee2450329ec48f7a9fa4,"Refactored DomXmlMessageValidator * Reduced Cyclomatic Complexity (3 Sonar warnings eliminated) * Added some Unit-Tests to backup refactoring * Discovered (and fixed) Bug: when an element contained validation matchers on attribute and(!) element value, the validation for attribute was never performed"
b8ed4172c20f0811af8b4e74105d78d65786e619, - fixed linked events moving wrong event  - fixed moving a boundary boxed event causing it to resize when it actually hit the boundary dates  - same for resizing  - hitting ESC when doing a resize/drag will now cancel that resize/drag and move it back to where the drag/resize started - memory optimizations - speed improvements - virtual vertical area with no canvas size limitation - customizable horizontal scrollbars - header date clicking + event firing - scrollbar update fixes - tons more
b8eecc041ad4aa23a3bf5cf7c8847573b125d187,SONAR-2149 Resource filters are ignored in complexity distributions of Java projects
b8f132100f7483954a57941af923e3cf3de65e2e,"added setting of send/recv buffer in TCP, made frag buffer size determination static in AUTOCONF"
b8f14b0c67995f3372af529772d91ee9c1af8874,SONAR-4923 List inheritance profiles now uses Java facade
b915deb01c55c0786df80ba81507948c229b3f33,decomposition of attribute in fields
b9162b844ad47c1db6c996c7a3a72fb9eaa50979,3D Viewer: Make the rotation step size adjustable.
b933d659fa0c61ba375fa722bf31dbf196e6f748,OGM-389 Establishing common abstraction of embedded and document-based associations
b965695d4788b7535bad40b253c3d825723d8231,Add option to limit batch size based on duration:
b9715e34d997ccfc369ba074abee650ce557aa67,Add tests and support for deployment type inheritance
b97efbf27e8e8dc78bd2cf832bc457e4fafc4e45,- Summary: fix bug 123202: Outline of chart area is not displayed completely in preview of chart builder. - Bugzilla Bug (s) Resolved: 123202 - Description: enlarged image buffer size to fit in the outline - Tests Description  :
b9b53575e822c1219161bae1644443840a54f6ca,"SONAR-3900 Add new metrics ""complexity in classes"" and ""complexity in methods"" to compute ""complexity/class"" and ""complexity/method"""
b9be32cf55c5b710665193a6778de5c0d4e6cd6a,Reduced map operation inheritance tree.
b9f634a50405df496eef3a5cd241531c6df8deb9,HIVE-1642 Convert join queries to map-join based on size of table/row (Liyin Tang via namit)
b9f861e5aede0c4a5715e93155c78a260a6fb823,TOMEE-1212 reading thread and queue size from context and creating a local executorservice if needed + flushing tasks before quitting
b9fe6f99398843d84cb967cea29a53996019e4ba,"Remove Client, Request, Response, TypedInput, and TypedOutput abstractions."
ba0417b84f2f970f1e2b59a0cf7a06cbd37a7f2d,HIVE-7119: Extended ACL's should be inherited if warehouse perm inheritance enabled (Szehon via Xuefu)
ba3f0de654d64cc8a5fe3a6c188cd857601fa71a,Cleaned up errors and warnings reported by PMD. Warnings for class size are suppressed so classes map to the file format specification. Only complexity warnings are left which will be fixed in due course where appropriate.
ba63eb86aaa93806082c07b4308c6473c80f6243,- use image size if < 150px - subclass for manipulated image uri possible
ba6d95232401ce533fb8c121ade7f4a864d06f12,HBASE-16747 Track memstore data size and heap overhead separately.
ba7a677591a14b066ee7e236803fd2b621c992ed,"AtlasProperties refactoring stage 2:  - atlas properties storage is abstracted by interface - storage implementations now include db-backed, old-style properties file-backed and composition of the above - storages list is configured through beans context - EF ignore options split to separate methods"
ba96860a91a27f07b3bc6345ac17b8326970e66a,Determine size of theming images and pass them to client Bug 284801: Pass image sizes to client https://bugs.eclipse.org/bugs/show_bug.cgi?id=284801
baa624d6dedc3f1fb01811479a83bbf629053d3b,"Fixed size of pre-created input maps in MapPutAllTest. Split up timeStep methods instead of property ""usePutAll"" in MapPutAllTest."
baaa542f08ad1d0411763edd327164b7834f909d,traits = multiple inheritance
babe4397d3aa675c147e4c3ecb995b257d234d8a,"Fixed bug that Container.compareStorageContainerCompatibility() is done by each instance of Container, for example CellContainer has to check if the cell size is the same."
bacca2593b24ec1f1855169dd212d07e9ec08278,Refactor some abstractions to make HadoopDomainCompactor locality optimization code cleaner.
baf7da75cf94093f2e2adb66a0ef88cc90f915ec,restructure tests in domains-toolabstraction-maven
bb274df3f5119b0b96bb757c039e7f963fd503c9,Use inheritance for preset classes like a good OOP boy should
bb6865cbc30d6f4ea0f5d78e0b86654b315b518d,[BZ 748483] Make dbsetup sequence id cache size configurable. Here the fallback size is the legacy value of 10 when unspecified.
bb6b0f56ca86b841071f21616e45ffa442f8a3dc,"Changed MisoSceneModel so that it knows about the view width and height. It no longer stores base tiles that are not visable in the view, in fact it stores the base tiles in an array almost half the size as the fully expanded scene array, and this new smaller array is used everywhere: when saving the scene, serializing it to the user, or saving it in the database. We must now use the getBaseTile() and setBaseTile() methods to access the base tiles because they are stored in this compressed format. Also removed the fringe layer completely from the MisoSceneModel."
bb755a01befd30c031965681aa8af8575bce52c5,"Bug 244865 – Support for Step Into Selection First Implementation: * Non-stop as well as All-stop debugging * Function / Method name validation, arguments size validation (no arguments signature yet) * Ctrl-F5 as short key (consistent with JDT) * Hyper link support with Ctrl-Shift click * Junit Test (Services part) Change-Id: I58903b4b6b7f9fd39a827f5297ad23ac3f96186d Reviewed-on: https://git.eclipse.org/r/11305 Reviewed-by: Marc-Andre Laperle <marc-andre.laperle@ericsson.com> IP-Clean: Marc-Andre Laperle <marc-andre.laperle@ericsson.com> Tested-by: Marc-Andre Laperle <marc-andre.laperle@ericsson.com>"
bb76e4d4fa97aa965d4848e0b94358bcb0d5772c,"JBEHAVE-329: Reverted to Brian Repko's original implementation, as it give more fine-grained and extensible control of inheritance behaviour of array values."
bb97fd37007bd96f3edab8bd3dad6b7043116165,Better encapsulation for AbstractClientSession.
bbd4a5097460af9a82edf8ec80b72d2b4b41416a,Added datastore-api module for abstraction
bbe3e60e2f2ee1becd5f0a3f207ac25003d7989f,0 snap size now works fine.
bc2c28979644a45eb7b5fd3196ffe33a7fa9d205,Migrate to updated DB structure to adhere to key size limits common to DBs
bc3587cfc9a3a6d5c4bc9f0afa35cbe8e4653fe3,fix failing RecoverExpiredMessagesTest - remove duplicate ref to secedualler task in jdbc pa inheritance and fix persistence adapter ref in test
bc382e770f40341c0369616a5d8fac5179516ab2,Store upgrade modifications to work with FileSystemAbstraction instead of File directly. Made some store upgrade tests use EphemeralFileSystemAbstraction for faster execution.
bc47cd654abf4b0826b9737bd6e9cd6389f80c1c,Refactored/simplified ExecuteSQLQueryAction * reduced LOC/Cyclomatic complexity * removed (undocumented) double retry handling * restructured code
bc81d3ed9c1a571eb2d8db1ddb878784f3343737,Use delegation rather than inheritance to decouple JLine
bc8d3b71e73a0fe71b4c7c4ce9307bf17fd76f6e,SCRUM-742 - DefaultInheritanceContentDecorator uses the inheritance configuration from the area definition - ConfiguredInheritance allows turning inheritance off for nodes and properties separately and configuring comparator and predicate for inherited components
bc9cdfc71ce519e034d2fbdfe25a55c5d5c6469d,fixes to CQL filter composition
bcbb6d67ae9d1481a00b5f3604a2944bba21d3d2,=+ Renamed length to size on hash ops
bcf4d4edaa91c971e606cddf7e987ffd8fe0ea61, - initial abstraction and construction of error estimating process
bd1bdbe217eb8e8de60ed37139f48c03d8c10fc0,"enhanced the journal so that it supports using its underlying bytes object without any wrapping, or using the structs abstraction;  thus giving the option of extra speed vs simpler maintenance"
bd3733a937a1112273a85ca2c9c48cc7fee214f5,Allow modules to depend on Published components from other modules through the importModule() statement. Created a way to test composition scripts in modules without a physical module.
bd5f550573b78492fd7861fa68490cc5a23a953b,bug-fix inheritance role attribute setting
bd9a569e549499f37dea303bd71f685682575458,"improved element abstraction, updated pom"
bd9b8d9516a127c98fc9b987fae84898e4207145,TEZ-2234. Add API for statistics information - allow vertex managers to get output size per source vertex (bikas)
bdb6214d5593360bfb197266fcdcd1d95098ac58,Support size based pagination for fixed layout reports.
bdc3babd75eb1499ed421156d3771f382ac39530,Docs BeanManager lookup abstraction
bddcd0866ffafb773b8f603fb498e5932cae8f5c,NXP-14278: refactor to remove unneeded abstractions
be2692554f69d2e28e66b89642e8a6a546626e9e,"abstraction++ pas fini, mais je commit avant qu'on travail en double"
be2b765c1f6df3b0a0d6bbc2b5b94f042f4883d2,chore(engine): rename batch size to batch total jobs
be6561edd0f65026d9546a1362988ea61b175d3f,"Complete project restructure in order to support multiple versions using Abstraction with maven, can now support multiple NMS versions from 1.8 and above. Support for 1.9.4 and 1.10 have been added previous versions will be added upon request. Release 0.15.0"
be6cd4008b251880e1e6bc53b3acb4e16a174049,promoted the method up the inheritance chain.
be6d931f3e1f51251e8ffaf72f807a8794848163,o Added some more unit tests for all getRelationships methods premutations o Fixed bug in IntArray composing new array when size was 1 and that element    should be removed  
be73665c1cc6155bbd64efe467878616a9546f76,added an abstraction to control the pruning of a tree.
beab9a72ca5bbbc305d4ec3b8063d9fa7d632a68,[ADD] WebDAV: added modification date and size for files and folders
bec836ad1a00f713a29e8a9e17acf5293d6e0113,"* com.vividsolutions.jump.workbench.ui.FontChooser 	* sample text i18n -> ui.FontChooser.sampletext 	* possibilty to set the font size in the dialog introduced 		* The GUI code was already present in jbinit(), but the components 		  was not finaly added to the dialog. 		* Added a new showDialog() and constructor with a flag for showing 		  the fontsize components or not."
bf0eeae8167148e58c20d07d314c0d32ab6a45ca,Migrate complexity metric to Syntax Tree
bf1200c8704d1a3e55e28580ef437fe33c4f4121,more inheritance testing
bf21e26f7c8dad59b0990261b6d66a087fb7b372,add support to specify font size for blankblocktext
bf510af3e8eb5b518dbfcc216a40907dd8d7cd47,SONAR-1722: Rename ActiveRule.overrides to AcriveRule.overridden SONAR-2052: Support inheritance of quality profiles in backup of global configuration
bf52a8ad1b22a2b334e44a11c7c3226d3f33ad6f,"Gideon : Implemented a smarter way to do the matching of alternate nonterminals for soft syntactic constraint decoding. As it turns out, naive matching based on looping over all child non-terminals in a children table from the Trie, is just too expensive for reasonable size grammars. In fact the best would be split the Trie in two parts: one for children that are non-terminals and one for children that are terminals. This would be the most general solution. This is an expensive solution only in that is requires a thorough refactoring of the rule table code."
bfb1dc03b46ef9d737fea18fb25ae03c47d0d5ad,Sorts now by correlation coefficient and if it is equal by size of overlapping area
bfb8837d7e95d4ba35d51a30cfd8a324c58efd93,Class inheritance allowing GUI module to inherit command-line arguments from non-GUI application.
bfb99b2ed0de41661f38a542a5bea8d5ddaeffe6,0.9c - Multiple inheritance fixed
c02f92447221273be42a1835cf17e8c452c8b761,even compressed latlon array does not help for german size osm
c044038c3b932586c0d384b614254cc2d1838838,"Added NPathComplexity, ClassDataAbstractionCoupling, BooleanExpressionComplexity and ClassFanOutComplexity checks contributed by Simon Harris (requests 750757, 750758, 750760 and 750759). IsEqualsMethod() moved from CovariantEqualsCheck to ChecUtils."
c0538de2eab2dfc82c4a2c5655ef585a49dbee34,[OPEN-HUDSON-6227] Allowing view path not to be the same as view tag Refactoring : include most cleartool commands under ClearTool abstraction. Removed most of specific implementations of ClearTool to centralize in CleartoolExec
c0659849ff93b722255ab22a8ac9b043d36f27a6,"SAK-1910, warn if file size too big"
c0b4c90a31009d38dfd02e8e55e307527afc3867,Fix path size for Windows build...
c0c8fc52acc9785bacc1292a241e0e949afcda17,Polymorphism pushed all the way into the keys.
c0d1c28856b420fbef923f01baf7f21a049d0530,OPS: eliminate some unnecessary inheritance
c10746ba33cecb1aa3924d19f88fb7b7f8e8dfcf,SCRUM-661 - added constraint on only inheriting area nodes - inheritance is now by default disabled
c177e1c256dcae305b2721bd489a732cfe0fd977,Remove the Value abstraction in the request
c1b6e3ee15d297e4ba5deec891e5691acc9c085f,ISPN-1980 Distributed Queries problem when results size could be greater than HsQuery.maxResults
c1c520540091200572baf816dc8d86ba9f630b2e,"[MOD] XQuery, limit size of debugging output."
c1d0126fc6c64fd6e2473353b2a4a680639a6fba,Bug 103863 - Support encapsulation in SWT layout mechanism
c1d0ef3eea4e2f66621412a94b39741627f030d9,Allow NIOFileHandle's buffer size to be passed through from RAIS
c1e3bfd43ee87313966e26f652f2f144b9d93087,[CXF-3879] Allow controlling the maximum size of incoming attachments. Patch from Sam Meder applied.
c20bd6621594b3ab1939b62a41f57414b833bbce,Use the Property abstraction in the implementation of get/set property.
c25e6e5e0762868b6c91824cb4e0c28d226b8c0f,fixed media size json fixed user list crashes media timeline supports load more
c29254b5474d2c75ebbfe4cd021543b5bba69f9d,CLOUDSTACK-8121. Data disk properties are not updated upon Creation/Deletion of VM snapshots. Update the path and size of data volumes after snapshot creation/deletion by correctly trimming only the snapshot postfix of a disk.
c298f70390495bd0de5cb1c060420104e3163e52,refined size constraints for pruning of similarity candidate pairs
c2c44d0cfd9652751b6ab5f6199235787afdb38c,"minidmx updates, make output size configurable"
c2c5a587006d14cf7e32d345b7be65dd30922bb5,"XWIKI-9309: Also search in attachments when type is DOCUMENT * Index attachment author, date and size * Make sure we can sort attachment results by file name, author, date and size * Duplicate attachment data on document index rows (using multiValued fields, so the relation between various attachment meta data is lost -- we won't know that a file size corresponds to a file name) * Add media type, author, date and size facets for attachments. * Refactor (and improve) DocumentSolrMetadataExtractorTest"
c2cff91de2c4e5caf9ac859bc8e910134f518644,Allow existing bolt/spouts to receive signals (without inheritance) Align with storm 0.7.4
c2dfe5d527baa509a8eb0f9d9ba434b96a3bdc50,ISPN-2287 Introduce DistributedTask abstraction enhancement for distributed executors
c2e6c2dfce058c538d0bb2804c8f2496ac8eef12,"added tests for ""graded"" complexity reports"
c2f373fb796f128e7596c9cbc1b4f4e253b994a1,Add inheritance to project dashboard loading.
c3003c2d416566348bc7f5b4ffb65fa6d7e2352f,add QRDecomposition interface
c324046a543ecb0661d1860404f8218426707e9d,"Add size(Object) method to find the size of various collection-like objects bug 27909, from Steven Melzer"
c32bbe742e8d77cf6602352d165890d944723e42,"removed mult and add value functions and created a single function called op-value. this function takes an operator like +, -, *, div, mod and operates on hte values of a list, element, or map. also, added a very useful function called ctx-count() which returns the size of the current path context --- very good for modulating operations by that size. Added test cases and updated the documentation appropriately. The rest of today will be doing the add/remove vertices/edges documentation and cleaning up text here and there. Plan for a 0.1-alpha release on Christmas."
c33e0e75caa6cc4b1ca78c04fc27539e8944b70c,[CXF-5902] Set default IV size in to the typical block size in bits
c37be07e4c8a8c89fbb7c873dbc7e7f4df82dd84,fixes based on Sonar reports added more inheritance related tests
c38d875372ed0c9172ff914733be8b407c7a7eeb,inheritance bug (try 3)
c397cc5ecaa276c9414ab040be831e408f2065d6,Cleaned most of the checkstyle errors on complexity but this thing definitely needs to be rewritten
c3b0c9538929002c6c84fe195c0d63b90cfa87a9,reading size improved
c4da4c3c2f4dfe54dc22304ae022d403958ebc96,Config / impl decoupling cont'd
c50a9e589f71096a03676df4740b7581e4830aa8,Change package composition.
c564b315653f63d036a577dbcd77f069cd534289,Huge decomposition of all web services bot tests
c5778366f5680a6b7128325fe4dea18876683f01, * FIX: cache size stat name
c5c2ea1d0b782c1029ce4e95fc76942ca184159a,It was added changed in the model -> association classes refactorized -> includes new associations in the model -> it has an inheritance from IResourceModel 
c5e92b02a908be15fa306260de65250e914acb85,"Tweak, batch size control on command-line"
c604ed9440babc16d67668f4b30d6f933a7b48d1,"Several improvements to new indel genotyper (more to come soon): a) Turns out previous change of centering haplotype around indel was a bad idea. Context to the left of indel is important but not as important as right one, because by definition all alleles start at the same location, so haplotype is the same to the left of indel regardless of allele. So, go back to having a constant size window to the left of event. b) Expand reference context so we can test larger haplotypes. c) Optimize computation of read likelihoods by doing them in linear array instead of in a matrix - no difference in biallelic sites but could be significantly faster in multiallelic sites. d) Bug fix: read alignment wasn't being computed correctly if, a) we were at an insertion, b) read started right at the insertion, c) read CIGAR didn't include insertion - more of these corner conditions are lurking, so a revamped computation of how reads align to candidate haplotypes is in the works. e) Add debug option not to use prior haplotype likelihoods. f) Don't hard-code NA12878 for genotyping, now sample name is a required input argument. g) Bug fix: if there are no reads covering a candidate indel event, just output NO_CALL (didn't notice this in HiSeq, but in P1 data it happens all the time). I need to add a confidence threshold for calling later on."
c62051863e5760926f82302a053b83f6b2918c3c,Use new transaction abstraction from ToHUtils. Some command refactoring.
c64fb85d1435a80fe946bac36d09ca0a66a6bdc4,"Updated Grammar for matching JsonArray to be left-associative rather than right-associative. Gson can now parse arrays of size over 11MB instead of 80KB which was the prior limit. Thanks for the tip, kenotron."
c6a9c1a8f53e7c699a6e431d41bd157e841a44bf,More work on abstraction
c6c3218cb769bacd26cc8a094e553f3e8c5679d1,[MECLIPSE-501] Made project configuration/import more robust by decoupling from plugin resolution
c70b2e862ff5b62e871d68284d0356d3d37db1bc,More work on Look & Feel and maximum heap size support.
c70f7ad9cbf460c5d58c799a49eebd00a63d0f10,Made reactor pool size configurable per memcachedclient object to set different pool size per client object
c7238bd4c792bef1d10dd78c50ada76bb45f255d,create ThresholdGroup abstraction to make configuration more clear -- reviewed by mhuot
c747394e97c41b3266d4501b9c1f7c22cde4470c,Support Junit4 in MifosMockStrutsTestCase: remove extend and use composition
c757690c4fe8e7e25ee2b6bf40e7dc2e4aeed23a,ISPN-1889 Use a ConcurrentMapFactory abstraction when constructing concurrent maps
